{
  "schema_version": "yonerai-installer-bootstrap-manifest/v1",
  "product": "YonerAI",
  "channel": "alpha",
  "version": "0.1.0-alpha.test.1",
  "published_at": "2026-05-23T00:00:00Z",
  "production_ready": false,
  "release": {
    "tag": "v0.1.0-alpha.test.1",
    "github_release_url": "https://github.com/YoneRai12/YonerAI/releases/tag/v0.1.0-alpha.test.1",
    "manifest_status": "signed"
  },
  "minimum_requirements": {
    "python": ">=3.11",
    "windows": "10 or newer for future Windows bootstrapper",
    "network_required": false
  },
  "artifacts": [
    {
      "id": "yonerai-0.1.0-alpha.test.1-source-archive",
      "kind": "source_archive",
      "target": "source-any",
      "os": "any",
      "arch": "any",
      "url": "https://example.invalid/YonerAI-0.1.0-alpha.test.1.zip",
      "sha256": "0000000000000000000000000000000000000000000000000000000000000000",
      "size_bytes": 1,
      "signature": {
        "status": "signed",
        "algorithm": "ed25519",
        "key_id": "test-non-production-ed25519-2026-05-23",
        "signature": "FttsYubK2vHBr7+RlRHkhKN6DoGcfh7V1x8vYT4aNCMbsriWSKrCy9qjjl/kyAohSshpF2EUpEV7x3Oje0KwAA=="
      }
    }
  ]
}
