{
  "schema_version": "yonerai-installer-bootstrap-manifest/v1",
  "product": "YonerAI",
  "channel": "stable",
  "version": "0.5.0",
  "published_at": "2026-05-26T07:50:57Z",
  "production_ready": false,
  "release": {
    "tag": "v0.5.0",
    "github_release_url": "https://github.com/YoneRai12/YonerAI/releases/tag/v0.5.0",
    "manifest_status": "unsigned_example"
  },
  "minimum_requirements": {
    "python": ">=3.11",
    "windows": "10 or newer for the documented PowerShell local CLI path",
    "network_required": false
  },
  "install_methods": [
    "manual_zip_venv",
    "powershell_dry_run_plan",
    "manifest_verify_only"
  ],
  "warnings": [
    "production signature verification is not available in this public manifest",
    "manual ZIP install requires the user to extract the archive and run local commands",
    "no remote execution installer is included",
    "no PATH mutation is performed by default"
  ],
  "artifacts": [
    {
      "id": "yonerai-0.5.0-source-archive",
      "kind": "source_archive",
      "target": "source-any",
      "os": "any",
      "arch": "any",
      "url": "https://github.com/YoneRai12/YonerAI/releases/download/v0.5.0/YonerAI-0.5.0.zip",
      "sha256": "8a0a625c8cca899224e6fbead7bcc159c7010d58c16db941006341759263ab39",
      "size_bytes": 9007426,
      "signature": {
        "status": "placeholder_non_production",
        "algorithm": "none",
        "key_id": "PLACEHOLDER_NON_PRODUCTION_KEY",
        "signature": "PLACEHOLDER_NON_PRODUCTION_SIGNATURE"
      }
    }
  ]
}
