{
  "schema_version": "yonerai-installer-bootstrap-manifest/v1",
  "product": "YonerAI",
  "channel": "alpha",
  "version": "0.17.0-alpha.1",
  "published_at": "2026-06-05T00:00:00Z",
  "production_ready": false,
  "release": {
    "tag": "v0.17.0-alpha.1",
    "github_release_url": "https://github.com/YoneRai12/YonerAI/releases/tag/v0.17.0-alpha.1",
    "manifest_status": "unsigned_example"
  },
  "minimum_requirements": {
    "python": ">=3.11",
    "windows": "10 or newer for the documented PowerShell local CLI path",
    "network_required": false
  },
  "install_methods": [
    "manual_zip_venv",
    "powershell_dry_run_plan",
    "manifest_verify_only"
  ],
  "warnings": [
    "alpha prerelease manifest; not the stable CLI Local Runtime release",
    "not a production network installer",
    "production signature verification is not available in this public manifest",
    "manual ZIP install requires the user to extract the archive and run local commands",
    "install.ps1 is plan-only and points explicit local install to install-local.ps1 after manual extraction",
    "install-local.ps1 is plan-first and only installs into a local environment when execution is explicit",
    "no PATH mutation is performed by default",
    "staging Google login is contract/UX only",
    "production Google login is not included",
    "Google client secrets are not included in the public repo",
    "token exchange is not performed in the public CLI",
    "refresh token plaintext storage is not enabled",
    "account sync is not performed by the public CLI",
    "local private memory is not uploaded automatically",
    "OpenAI shared traffic remains disabled by default",
    "production AWS backend is not included",
    "production Oracle/cloud runtime is not included",
    "self-evolution remains proposal-only and does not mutate code or releases"
  ],
  "artifacts": [
    {
      "id": "yonerai-0.17.0-alpha.1-source-archive",
      "kind": "source_archive",
      "target": "source-any",
      "os": "any",
      "arch": "any",
      "url": "https://github.com/YoneRai12/YonerAI/releases/download/v0.17.0-alpha.1/YonerAI-0.17.0-alpha.1.zip",
      "sha256": "507ef27af80fd14e5cc17520036faa8e19f4769457978142c747b5b812df72c9",
      "size_bytes": 15896590,
      "signature": {
        "status": "placeholder_non_production",
        "algorithm": "none",
        "key_id": "PLACEHOLDER_NON_PRODUCTION_KEY",
        "signature": "PLACEHOLDER_NON_PRODUCTION_SIGNATURE"
      }
    }
  ]
}
