{
  "schema_version": "yonerai-installer-bootstrap-manifest/v1",
  "product": "YonerAI",
  "channel": "alpha",
  "version": "0.12.0-alpha.1",
  "published_at": "2026-06-01T00:00:00Z",
  "production_ready": false,
  "release": {
    "tag": "v0.12.0-alpha.1",
    "github_release_url": "https://github.com/YoneRai12/YonerAI/releases/tag/v0.12.0-alpha.1",
    "manifest_status": "unsigned_example"
  },
  "minimum_requirements": {
    "python": ">=3.11",
    "windows": "10 or newer for the documented PowerShell local CLI path",
    "network_required": false
  },
  "install_methods": [
    "manual_zip_venv",
    "powershell_dry_run_plan",
    "manifest_verify_only"
  ],
  "warnings": [
    "alpha prerelease manifest; not the stable CLI Local Runtime release",
    "not a production network installer",
    "production signature verification is not available in this public manifest",
    "manual ZIP install requires the user to extract the archive and run local commands",
    "install.ps1 is a plan-first skeleton and does not install anything unless explicit execution flags are used",
    "install-local.ps1 is plan-first and only installs into a local environment when execution is explicit",
    "no PATH mutation is performed by default",
    "Google OAuth remains dry-run/contract only",
    "official account sync remains contract/fixture only in the public repo",
    "local private memory is not uploaded automatically",
    "OpenAI shared traffic remains disabled by default",
    "self-evolution remains proposal-only and does not mutate code or releases"
  ],
  "artifacts": [
    {
      "id": "yonerai-0.12.0-alpha.1-source-archive",
      "kind": "source_archive",
      "target": "source-any",
      "os": "any",
      "arch": "any",
      "url": "https://github.com/YoneRai12/YonerAI/releases/download/v0.12.0-alpha.1/YonerAI-0.12.0-alpha.1.zip",
      "sha256": "d6170014bbbcdd6d7742c738e1993405768bbc924376b559b51624227751e088",
      "size_bytes": 15278263,
      "signature": {
        "status": "placeholder_non_production",
        "algorithm": "none",
        "key_id": "PLACEHOLDER_NON_PRODUCTION_KEY",
        "signature": "PLACEHOLDER_NON_PRODUCTION_SIGNATURE"
      }
    }
  ]
}
